{
  "$schema": "./architecture-baseline.schema.json",
  "version": 1,
  "description": "What a NEW project should be, per stack. config/stack-mappings.json answers the opposite question — 'what is this repo?' — by matching indicator files. These are two different acts: detection is a measurement, a baseline is a decision, and merging them would make it impossible to tell a recorded choice from an observed fact. Keyed to the same stack ids so a reader can join them.",

  "versionPolicy": {
    "rule": "Every version below is a recorded value with a date and a source, never a live measurement. State the recorded value AND the version you actually observe in the toolchain, and name which is which. An agent that reports only the recorded number is quoting this file back at itself, which is not evidence.",
    "onDrift": "When the observed toolchain is NEWER than the recorded minimum, use the observed one and say so — the minimum is a floor, not a ceiling. When it is OLDER, that is a finding: report it, do not silently downgrade the design, and do not propose an API the project cannot compile. When the gap is more than one major, say plainly that this file is stale rather than pretending the number is current.",
    "sourceMeaning": {
      "measured": "Read from a live toolchain or lockfile on verifiedOn. Trustworthy.",
      "user-directed": "The user stated this explicitly. Binding regardless of what a corpus or a default says.",
      "model-recall": "Written from the authoring model's training knowledge, NOT checked against a release feed. Treat as a plausible floor and verify before quoting it to anyone. This is the weakest source in the file and most entries carry it."
    }
  },

  "precedence": {
    "greenfield": "PRESCRIPTIVE. There is no repository convention to defer to yet, so this file supplies one. Departing from it is a decision that gets recorded as an ADR via scripts/decision.py, not a silent choice.",
    "brownfield": "ADVISORY ONLY. Report the gap between the baseline and what the repo does; never rewrite working code to close it, and never introduce a second mechanism alongside an existing one. A migration is its own decision with its own ADR.",
    "repoOverride": "A consumer repository's own CLAUDE.md or copilot-instructions.md outranks every value in this file, in both directions. A hub that overrides a team's stated convention is a hub that gets uninstalled."
  },

  "productionGrade": {
    "concerns": [
      { "id": "observability", "gate": "before-first-pr",
        "requirement": "Structured logging with a correlation id propagated across every boundary, plus traces and metrics exported through a vendor-neutral API.",
        "why": "Retrofitting correlation ids means touching every call site at once. It costs almost nothing on day one and is a multi-week project after the first incident." },
      { "id": "health-and-readiness", "gate": "before-first-pr",
        "requirement": "Separate liveness and readiness signals. Readiness must actually check the dependencies the service cannot serve without.",
        "why": "A liveness probe that returns 200 because the process is running will keep a service in the load balancer while every request fails on a dead database." },
      { "id": "configuration", "gate": "before-first-pr",
        "requirement": "Bound once into a typed object and validated at startup. No untyped key lookups deep in business logic.",
        "why": "A typo in an untyped config key becomes a null at three in the morning instead of a failure to start." },
      { "id": "secrets-management", "gate": "before-first-pr",
        "requirement": "Secrets come from an external store or injected environment. Never committed, never defaulted to a working value in source.",
        "why": "A secret with a working default in source gets deployed as-is, and the commit that introduced it is the one nobody reviews closely." },
      { "id": "authn-authz", "gate": "before-production",
        "requirement": "Deny by default. Authorization decided at a single enforcement point, not scattered across handlers.",
        "why": "Allow-by-default plus per-handler checks means every new endpoint is unprotected until someone remembers. The failure is silent and looks like working code." },
      { "id": "input-validation", "gate": "before-first-pr",
        "requirement": "Validated at the boundary against an explicit schema, before it reaches domain logic.",
        "why": "Validation spread through the domain layer cannot be audited, and the one path that skipped it is the one that gets found." },
      { "id": "error-contract", "gate": "before-first-pr",
        "requirement": "A typed, documented error shape. Never a raw stack trace or an internal exception message to a client.",
        "why": "Stack traces leak framework versions, file paths, and query structure — reconnaissance handed over for free." },
      { "id": "resilience", "gate": "before-production",
        "requirement": "Every outbound call carries an explicit timeout. Retries use exponential backoff with jitter and are applied only to idempotent operations.",
        "why": "A missing timeout turns one slow dependency into thread-pool exhaustion. Retries without jitter turn a blip into a synchronised stampede." },
      { "id": "data-migrations", "gate": "before-first-pr",
        "requirement": "Versioned, source-controlled, forward-only, and reviewed like code. Expand-then-contract for anything that breaks a running deployment.",
        "why": "A schema change applied by hand cannot be rolled back or reproduced in another environment, and nobody can tell which environments received it." },
      { "id": "testing", "gate": "before-first-pr",
        "requirement": "Unit tests on domain logic, integration tests against a real dependency rather than a mock of it, and end-to-end coverage of the critical user paths.",
        "why": "A suite that mocks the database proves the mock works. The bugs that reach production live in the seam that mocking removed." },
      { "id": "supply-chain", "gate": "before-first-pr",
        "requirement": "A committed lockfile, automated dependency vulnerability scanning, and a generated SBOM.",
        "why": "Without a lockfile the build is not reproducible, so the artifact that passed CI is not provably the artifact that shipped." },
      { "id": "ci-gate", "gate": "before-first-pr",
        "requirement": "Build, test, lint, and a security scan all pass before merge, enforced by the platform rather than by convention.",
        "why": "A gate that relies on people remembering is not a gate. It holds until the first urgent Friday deploy." },
      { "id": "api-contract", "gate": "before-production",
        "requirement": "Versioned and machine-readable, generated from the code rather than maintained beside it.",
        "why": "Hand-maintained API docs drift within weeks, and a consumer that trusts them breaks in a way the producer cannot reproduce." },
      { "id": "rollback", "gate": "before-production",
        "requirement": "A documented, exercised rollback path — including what happens to data written by the version being rolled back.",
        "why": "A rollback plan first attempted during an incident is a hypothesis, and the data written by the bad version is the part it usually forgets." }
    ]
  },

  "baselines": [
    {
      "id": "dotnet-service",
      "name": ".NET service (command and query sides)",
      "appliesToStacks": ["dotnet-cqrs", "dotnet-query"],
      "runtime": { "name": ".NET", "minimum": "10.0", "knownLatestAtAuthoring": "10.0", "channel": "LTS", "cadence": "One major each November; even-numbered majors are LTS with 3 years support, odd are STS with 18 months.", "verifiedOn": "2026-05", "source": "user-directed" },
      "language": { "name": "C#", "minimum": "14", "required": ["Nullable=enable", "ImplicitUsings=enable", "TreatWarningsAsErrors=true", "LangVersion=latest"] },
      "architecture": {
        "default": "Modular monolith organised in vertical slices — one feature owns its endpoint, handler, validation, and persistence together. Split CQRS onto separate read and write models only where the read genuinely diverges from the write.",
        "why": "A vertical slice keeps everything a change touches in one folder, so the blast radius of a feature is visible in the directory tree. A modular monolith gets the module boundaries of microservices without paying for a network hop and a distributed transaction before there is any evidence that either is needed. CQRS applied uniformly to every entity is ceremony: most entities read the way they write.",
        "escalateTo": "Extract a module into its own service when it needs an independent deploy cadence or independent scaling AND owns data no other module reads directly. Two of the three is not enough — the network boundary costs more than the coupling it removes.",
        "layers": ["Api (endpoints, contracts)", "Application (handlers, validation, orchestration)", "Domain (entities, invariants — no framework references)", "Infrastructure (persistence, outbound clients)"]
      },
      "modernCapabilities": [
        { "use": "Minimal APIs with TypedResults and endpoint groups", "insteadOf": "MVC controllers for new services", "since": ".NET 6, matured through 10", "note": "TypedResults keeps the response type in the signature, so OpenAPI generation stops guessing." },
        { "use": "Primary constructors and collection expressions", "insteadOf": "Boilerplate constructor assignment and new List<T> { ... }", "since": "C# 12" },
        { "use": "record and required members", "insteadOf": "Mutable DTO classes with settable properties", "since": "C# 9 / C# 11", "note": "required moves a missing-field bug from runtime null to compile error." },
        { "use": "Keyed DI services", "insteadOf": "Factory-with-switch dispatch on a string", "since": ".NET 8" },